{
  "$schema": "./baseline.schema.json",
  "version": "1",
  "description": "Performance baselines for Stati build benchmarks",
  "updated": "2026-10-25T00:00:00.000Z",
  "environment": {
    "nodeVersion": "22",
    "pageCount": 100,
    "note": "Medians from 27 green perf.yml runs on ubuntu-latest, 2026-10-18 to 2026-10-25"
  },
  "thresholds": {
    "coldBuild": {
      "medianMs": 60,
      "tolerance": 0.3,
      "minHeadroomMs": 25
    },
    "warmBuild": {
      "medianMs": 35,
      "tolerance": 0.3,
      "minHeadroomMs": 25,
      "minCacheHitRate": 0.95
    },
    "incrementalBuild": {
      "medianMs": 40,
      "tolerance": 0.3,
      "minHeadroomMs": 25
    },
    "complexBuild": {
      "medianMs": 60,
      "tolerance": 0.3,
      "minHeadroomMs": 25
    }
  }
}
